{"schema_version":"1.1.0","case_id":"QD-02","execution":{"execution_id":"syn-qd-02","status":"completed_with_warnings","pipeline_version":"synthetic-1","rule_catalog_version":"synthetic-1","counts":{"files":2,"rows_read":20,"errors":1,"warnings":1}},"occurrences":[{"evidence_id":"ev-qd02-1","severity":"error","code":"missing_workorder","reason":"Workorder ausente.","sheet_name":"Plano","row_number":2,"column_name":"workorder","details":{"constraint":"required","source_name":"synthetic-plan"}},{"evidence_id":"ev-qd02-2","severity":"warning","code":"unknown_lot","reason":"Lote sem correspondência.","sheet_name":"Lotes","row_number":3,"column_name":"lot","details":{"received_value":"LOT-SYN-9","source_name":"synthetic-lots"}}]}
