{"schema_version":"1.1.0","case_id":"QD-03","execution":{"execution_id":"syn-qd-03","status":"completed_with_warnings","pipeline_version":"synthetic-1","rule_catalog_version":"synthetic-1","counts":{"files":2,"rows_read":12,"errors":1,"warnings":0}},"occurrences":[{"evidence_id":"ev-qd03-1","severity":"error","code":"conflicting_quantity","reason":"Quantidade divergente entre fontes.","workorder_number":"WO-SYN-03","sheet_name":"Plano","row_number":4,"column_name":"quantity","details":{"expected_value":10,"received_value":12,"source_name":"synthetic-plan"}},{"evidence_id":"ev-qd03-2","severity":"error","code":"conflicting_quantity","reason":"Quantidade divergente entre fontes.","workorder_number":"WO-SYN-03","sheet_name":"Resultado","row_number":5,"column_name":"quantity","details":{"expected_value":10,"received_value":12,"source_name":"synthetic-result"}}]}
