{"schema_version":"1.1.0","case_id":"QD-04","execution":{"execution_id":"syn-qd-04","status":"partial","pipeline_version":"synthetic-1","rule_catalog_version":"synthetic-1","counts":{"files":1,"rows_read":1,"errors":1,"warnings":0}},"occurrences":[{"evidence_id":"ev-qd04-1","severity":"error","code":"missing_reference_data","reason":"Fonte de referência não fornecida.","details":{"constraint":"reference-required","source_name":"synthetic-input"}}]}
